Found cached dataset maccrobat_biomedical_ner (/home/s1/serimkim/.cache/huggingface/datasets/singh-aditya___maccrobat_biomedical_ner/default/0.0.0/974acf92c41cf1d5ddfe4bc372d577351657cfae1f57fe3899bbfc4c05ed09fc)
  0%|          | 0/1 [00:00<?, ?it/s]100%|██████████| 1/1 [00:00<00:00, 491.77it/s]
Some weights of the model checkpoint at /home/s1/serimkim/hf/distil-kobert-finetuned_KD_epoch5/checkpoint-15500 were not used when initializing DistilBertForTokenClassification: ['vocab_layer_norm.weight', 'vocab_layer_norm.bias', 'vocab_transform.bias', 'vocab_transform.weight', 'vocab_projector.bias', 'vocab_projector.weight']
- This IS expected if you are initializing DistilBertForTokenClassification from the checkpoint of a model trained on another task or with another architecture (e.g. initializing a BertForSequenceClassification model from a BertForPreTraining model).
- This IS NOT expected if you are initializing DistilBertForTokenClassification from the checkpoint of a model that you expect to be exactly identical (initializing a BertForSequenceClassification model from a BertForSequenceClassification model).
Some weights of DistilBertForTokenClassification were not initialized from the model checkpoint at /home/s1/serimkim/hf/distil-kobert-finetuned_KD_epoch5/checkpoint-15500 and are newly initialized: ['classifier.bias', 'classifier.weight']
You should probably TRAIN this model on a down-stream task to be able to use it for predictions and inference.
Loading cached processed dataset at /home/s1/serimkim/.cache/huggingface/datasets/singh-aditya___maccrobat_biomedical_ner/default/0.0.0/974acf92c41cf1d5ddfe4bc372d577351657cfae1f57fe3899bbfc4c05ed09fc/cache-a8a8aa885433f07f.arrow
Map:   0%|          | 0/160 [00:00<?, ? examples/s]Map: 100%|██████████| 160/160 [00:00<00:00, 380.40 examples/s]                                                              Map:   0%|          | 0/40 [00:00<?, ? examples/s]                                                  Using amp fp16 backend
***** Running training *****
  Num examples = 1221
  Num Epochs = 5
  Instantaneous batch size per device = 32
  Total train batch size (w. parallel, distributed & accumulation) = 128
  Gradient Accumulation steps = 1
  Total optimization steps = 50
Automatic Weights & Biases logging enabled, to disable set os.environ["WANDB_DISABLED"] = "true"
wandb: Currently logged in as: ksr5970. Use `wandb login --relogin` to force relogin
wandb: wandb version 0.16.2 is available!  To upgrade, please run:
wandb:  $ pip install wandb --upgrade
wandb: Tracking run with wandb version 0.16.0
wandb: Run data is saved locally in /home/s1/serimkim/hf/wandb/run-20240122_030417-vnocdrv4
wandb: Run `wandb offline` to turn off syncing.
wandb: Syncing run finetuned_distilkobert_ner_KD
wandb: ⭐️ View project at https://wandb.ai/ksr5970/huggingface
wandb: 🚀 View run at https://wandb.ai/ksr5970/huggingface/runs/vnocdrv4
cuda
  0%|          | 0/50 [00:00<?, ?it/s]/home/s1/serimkim/anaconda3/envs/hf/lib/python3.8/site-packages/torch/nn/parallel/_functions.py:68: UserWarning: Was asked to gather along dimension 0, but all input tensors were scalars; will instead unsqueeze and return a vector.
  warnings.warn('Was asked to gather along dimension 0, but all '
  2%|▁         | 1/50 [00:06<05:30,  6.75s/it]  4%|▁         | 2/50 [00:06<02:19,  2.91s/it]  6%|▌         | 3/50 [00:07<01:19,  1.68s/it]  8%|▊         | 4/50 [00:07<00:50,  1.11s/it] 10%|█         | 5/50 [00:07<00:35,  1.27it/s] 12%|█▁        | 6/50 [00:07<00:26,  1.68it/s] 14%|█▁        | 7/50 [00:08<00:20,  2.12it/s] 16%|█▌        | 8/50 [00:08<00:16,  2.54it/s] 18%|█▊        | 9/50 [00:08<00:13,  2.96it/s] 20%|██        | 10/50 [00:08<00:11,  3.42it/s]***** Running Evaluation *****
  Num examples = 314
  Batch size = 128

  0%|          | 0/3 [00:00<?, ?it/s][A
 67%|██████▋   | 2/3 [00:00<00:00, 14.60it/s][A/home/s1/serimkim/anaconda3/envs/hf/lib/python3.8/site-packages/seqeval/metrics/v1.py:57: UndefinedMetricWarning: Precision and F-score are ill-defined and being set to 0.0 in labels with no predicted samples. Use `zero_division` parameter to control this behavior.
  _warn_prf(average, modifier, msg_start, len(result))
/home/s1/serimkim/anaconda3/envs/hf/lib/python3.8/site-packages/seqeval/metrics/v1.py:57: UndefinedMetricWarning: Recall and F-score are ill-defined and being set to 0.0 in labels with no true samples. Use `zero_division` parameter to control this behavior.
  _warn_prf(average, modifier, msg_start, len(result))
                                               
                                             [A 20%|██        | 10/50 [00:09<00:11,  3.42it/s]
100%|██████████| 3/3 [00:00<00:00, 14.60it/s][A
                                             [ASaving model checkpoint to finetuned_distilkobert_ner_KD/checkpoint-10
Configuration saved in finetuned_distilkobert_ner_KD/checkpoint-10/config.json
Model weights saved in finetuned_distilkobert_ner_KD/checkpoint-10/pytorch_model.bin
tokenizer config file saved in finetuned_distilkobert_ner_KD/checkpoint-10/tokenizer_config.json
Special tokens file saved in finetuned_distilkobert_ner_KD/checkpoint-10/special_tokens_map.json
/home/s1/serimkim/anaconda3/envs/hf/lib/python3.8/site-packages/torch/nn/parallel/_functions.py:68: UserWarning: Was asked to gather along dimension 0, but all input tensors were scalars; will instead unsqueeze and return a vector.
  warnings.warn('Was asked to gather along dimension 0, but all '
 22%|██▁       | 11/50 [00:10<00:29,  1.33it/s] 24%|██▁       | 12/50 [00:10<00:22,  1.70it/s] 26%|██▌       | 13/50 [00:10<00:17,  2.09it/s] 28%|██▊       | 14/50 [00:11<00:14,  2.49it/s] 30%|███       | 15/50 [00:11<00:12,  2.88it/s] 32%|███▁      | 16/50 [00:11<00:10,  3.24it/s] 34%|███▁      | 17/50 [00:11<00:09,  3.53it/s] 36%|███▌      | 18/50 [00:12<00:08,  3.80it/s] 38%|███▊      | 19/50 [00:12<00:07,  4.01it/s] 40%|████      | 20/50 [00:12<00:06,  4.29it/s]***** Running Evaluation *****
  Num examples = 314
  Batch size = 128
{'eval_loss': 3.817664384841919, 'eval_precision': 0.043478260869565216, 'eval_recall': 0.0015552099533437014, 'eval_f1': 0.003003003003003003, 'eval_accuracy': 0.43440836783612985, 'eval_runtime': 0.5862, 'eval_samples_per_second': 535.681, 'eval_steps_per_second': 5.118, 'epoch': 1.0}

  0%|          | 0/3 [00:00<?, ?it/s][A
 67%|██████▋   | 2/3 [00:00<00:00, 14.66it/s][A/home/s1/serimkim/anaconda3/envs/hf/lib/python3.8/site-packages/seqeval/metrics/v1.py:57: UndefinedMetricWarning: Precision and F-score are ill-defined and being set to 0.0 in labels with no predicted samples. Use `zero_division` parameter to control this behavior.
  _warn_prf(average, modifier, msg_start, len(result))
                                               
                                             [A 40%|████      | 20/50 [00:13<00:06,  4.29it/s]
100%|██████████| 3/3 [00:00<00:00, 14.66it/s][A
                                             [ASaving model checkpoint to finetuned_distilkobert_ner_KD/checkpoint-20
Configuration saved in finetuned_distilkobert_ner_KD/checkpoint-20/config.json
Model weights saved in finetuned_distilkobert_ner_KD/checkpoint-20/pytorch_model.bin
tokenizer config file saved in finetuned_distilkobert_ner_KD/checkpoint-20/tokenizer_config.json
Special tokens file saved in finetuned_distilkobert_ner_KD/checkpoint-20/special_tokens_map.json
/home/s1/serimkim/anaconda3/envs/hf/lib/python3.8/site-packages/torch/nn/parallel/_functions.py:68: UserWarning: Was asked to gather along dimension 0, but all input tensors were scalars; will instead unsqueeze and return a vector.
  warnings.warn('Was asked to gather along dimension 0, but all '
 42%|████▁     | 21/50 [00:14<00:19,  1.47it/s] 44%|████▁     | 22/50 [00:14<00:15,  1.84it/s] 46%|████▌     | 23/50 [00:14<00:12,  2.24it/s] 48%|████▊     | 24/50 [00:14<00:09,  2.64it/s] 50%|█████     | 25/50 [00:15<00:08,  3.01it/s] 52%|█████▁    | 26/50 [00:15<00:07,  3.34it/s] 54%|█████▁    | 27/50 [00:15<00:06,  3.65it/s] 56%|█████▌    | 28/50 [00:15<00:05,  3.89it/s] 58%|█████▊    | 29/50 [00:15<00:05,  4.05it/s] 60%|██████    | 30/50 [00:16<00:04,  4.34it/s]***** Running Evaluation *****
  Num examples = 314
  Batch size = 128
{'eval_loss': 3.4674923419952393, 'eval_precision': 0.14285714285714285, 'eval_recall': 0.00019440124416796267, 'eval_f1': 0.0003882741215298, 'eval_accuracy': 0.43942035301808674, 'eval_runtime': 0.5819, 'eval_samples_per_second': 539.571, 'eval_steps_per_second': 5.155, 'epoch': 2.0}

  0%|          | 0/3 [00:00<?, ?it/s][A
 67%|██████▋   | 2/3 [00:00<00:00, 15.26it/s][A/home/s1/serimkim/anaconda3/envs/hf/lib/python3.8/site-packages/seqeval/metrics/v1.py:57: UndefinedMetricWarning: Precision and F-score are ill-defined and being set to 0.0 in labels with no predicted samples. Use `zero_division` parameter to control this behavior.
  _warn_prf(average, modifier, msg_start, len(result))
                                               
                                             [A 60%|██████    | 30/50 [00:16<00:04,  4.34it/s]
100%|██████████| 3/3 [00:00<00:00, 15.26it/s][A
                                             [ASaving model checkpoint to finetuned_distilkobert_ner_KD/checkpoint-30
Configuration saved in finetuned_distilkobert_ner_KD/checkpoint-30/config.json
Model weights saved in finetuned_distilkobert_ner_KD/checkpoint-30/pytorch_model.bin
tokenizer config file saved in finetuned_distilkobert_ner_KD/checkpoint-30/tokenizer_config.json
Special tokens file saved in finetuned_distilkobert_ner_KD/checkpoint-30/special_tokens_map.json
/home/s1/serimkim/anaconda3/envs/hf/lib/python3.8/site-packages/torch/nn/parallel/_functions.py:68: UserWarning: Was asked to gather along dimension 0, but all input tensors were scalars; will instead unsqueeze and return a vector.
  warnings.warn('Was asked to gather along dimension 0, but all '
 62%|██████▁   | 31/50 [00:17<00:13,  1.44it/s] 64%|██████▁   | 32/50 [00:18<00:09,  1.81it/s] 66%|██████▌   | 33/50 [00:18<00:07,  2.21it/s] 68%|██████▊   | 34/50 [00:18<00:06,  2.61it/s] 70%|███████   | 35/50 [00:18<00:05,  2.98it/s] 72%|███████▁  | 36/50 [00:19<00:04,  3.33it/s] 74%|███████▁  | 37/50 [00:19<00:03,  3.62it/s] 76%|███████▌  | 38/50 [00:19<00:03,  3.85it/s]                                                76%|███████▌  | 38/50 [00:19<00:03,  3.85it/s] 78%|███████▊  | 39/50 [00:19<00:02,  4.03it/s] 80%|████████  | 40/50 [00:19<00:02,  4.34it/s]***** Running Evaluation *****
  Num examples = 314
  Batch size = 128
{'eval_loss': 3.240433692932129, 'eval_precision': 0.0, 'eval_recall': 0.0, 'eval_f1': 0.0, 'eval_accuracy': 0.4395293092176945, 'eval_runtime': 0.574, 'eval_samples_per_second': 547.057, 'eval_steps_per_second': 5.227, 'epoch': 3.0}
{'loss': 3.6427, 'learning_rate': 4.800000000000001e-06, 'epoch': 3.8}

  0%|          | 0/3 [00:00<?, ?it/s][A
 67%|██████▋   | 2/3 [00:00<00:00, 15.23it/s][A/home/s1/serimkim/anaconda3/envs/hf/lib/python3.8/site-packages/seqeval/metrics/v1.py:57: UndefinedMetricWarning: Precision and F-score are ill-defined and being set to 0.0 in labels with no predicted samples. Use `zero_division` parameter to control this behavior.
  _warn_prf(average, modifier, msg_start, len(result))
/home/s1/serimkim/anaconda3/envs/hf/lib/python3.8/site-packages/seqeval/metrics/v1.py:57: UndefinedMetricWarning: Precision and F-score are ill-defined and being set to 0.0 due to no predicted samples. Use `zero_division` parameter to control this behavior.
  _warn_prf(average, modifier, msg_start, len(result))
                                               
                                             [A 80%|████████  | 40/50 [00:20<00:02,  4.34it/s]
100%|██████████| 3/3 [00:00<00:00, 15.23it/s][A
                                             [ASaving model checkpoint to finetuned_distilkobert_ner_KD/checkpoint-40
Configuration saved in finetuned_distilkobert_ner_KD/checkpoint-40/config.json
Model weights saved in finetuned_distilkobert_ner_KD/checkpoint-40/pytorch_model.bin
tokenizer config file saved in finetuned_distilkobert_ner_KD/checkpoint-40/tokenizer_config.json
Special tokens file saved in finetuned_distilkobert_ner_KD/checkpoint-40/special_tokens_map.json
/home/s1/serimkim/anaconda3/envs/hf/lib/python3.8/site-packages/torch/nn/parallel/_functions.py:68: UserWarning: Was asked to gather along dimension 0, but all input tensors were scalars; will instead unsqueeze and return a vector.
  warnings.warn('Was asked to gather along dimension 0, but all '
 82%|████████▁ | 41/50 [00:21<00:05,  1.55it/s] 84%|████████▁ | 42/50 [00:21<00:04,  1.94it/s] 86%|████████▌ | 43/50 [00:21<00:02,  2.34it/s] 88%|████████▊ | 44/50 [00:22<00:02,  2.74it/s] 90%|█████████ | 45/50 [00:22<00:01,  3.11it/s] 92%|█████████▁| 46/50 [00:22<00:01,  3.45it/s] 94%|█████████▁| 47/50 [00:22<00:00,  3.70it/s] 96%|█████████▌| 48/50 [00:23<00:00,  3.91it/s] 98%|█████████▊| 49/50 [00:23<00:00,  4.09it/s]100%|██████████| 50/50 [00:23<00:00,  4.38it/s]***** Running Evaluation *****
  Num examples = 314
  Batch size = 128
{'eval_loss': 3.1078619956970215, 'eval_precision': 0.0, 'eval_recall': 0.0, 'eval_f1': 0.0, 'eval_accuracy': 0.4395293092176945, 'eval_runtime': 0.5764, 'eval_samples_per_second': 544.762, 'eval_steps_per_second': 5.205, 'epoch': 4.0}

  0%|          | 0/3 [00:00<?, ?it/s][A
 67%|██████▋   | 2/3 [00:00<00:00, 15.60it/s][A/home/s1/serimkim/anaconda3/envs/hf/lib/python3.8/site-packages/seqeval/metrics/v1.py:57: UndefinedMetricWarning: Precision and F-score are ill-defined and being set to 0.0 in labels with no predicted samples. Use `zero_division` parameter to control this behavior.
  _warn_prf(average, modifier, msg_start, len(result))
/home/s1/serimkim/anaconda3/envs/hf/lib/python3.8/site-packages/seqeval/metrics/v1.py:57: UndefinedMetricWarning: Precision and F-score are ill-defined and being set to 0.0 due to no predicted samples. Use `zero_division` parameter to control this behavior.
  _warn_prf(average, modifier, msg_start, len(result))
                                               
                                             [A100%|██████████| 50/50 [00:24<00:00,  4.38it/s]
100%|██████████| 3/3 [00:00<00:00, 15.60it/s][A
                                             [ASaving model checkpoint to finetuned_distilkobert_ner_KD/checkpoint-50
Configuration saved in finetuned_distilkobert_ner_KD/checkpoint-50/config.json
Model weights saved in finetuned_distilkobert_ner_KD/checkpoint-50/pytorch_model.bin
tokenizer config file saved in finetuned_distilkobert_ner_KD/checkpoint-50/tokenizer_config.json
Special tokens file saved in finetuned_distilkobert_ner_KD/checkpoint-50/special_tokens_map.json


Training completed. Do not forget to share your model on huggingface.co/models =)


Loading best model from finetuned_distilkobert_ner_KD/checkpoint-50 (score: 3.0618975162506104).
                                               100%|██████████| 50/50 [00:24<00:00,  4.38it/s]100%|██████████| 50/50 [00:24<00:00,  2.00it/s]
{'eval_loss': 3.0618975162506104, 'eval_precision': 0.0, 'eval_recall': 0.0, 'eval_f1': 0.0, 'eval_accuracy': 0.4395293092176945, 'eval_runtime': 0.5582, 'eval_samples_per_second': 562.488, 'eval_steps_per_second': 5.374, 'epoch': 5.0}
{'train_runtime': 33.1514, 'train_samples_per_second': 184.155, 'train_steps_per_second': 1.508, 'train_loss': 3.5247801208496092, 'epoch': 5.0}
[{'eval_loss': 3.817664384841919, 'eval_precision': 0.043478260869565216, 'eval_recall': 0.0015552099533437014, 'eval_f1': 0.003003003003003003, 'eval_accuracy': 0.43440836783612985, 'eval_runtime': 0.5862, 'eval_samples_per_second': 535.681, 'eval_steps_per_second': 5.118, 'epoch': 1.0, 'step': 10}, {'eval_loss': 3.4674923419952393, 'eval_precision': 0.14285714285714285, 'eval_recall': 0.00019440124416796267, 'eval_f1': 0.0003882741215298, 'eval_accuracy': 0.43942035301808674, 'eval_runtime': 0.5819, 'eval_samples_per_second': 539.571, 'eval_steps_per_second': 5.155, 'epoch': 2.0, 'step': 20}, {'eval_loss': 3.240433692932129, 'eval_precision': 0.0, 'eval_recall': 0.0, 'eval_f1': 0.0, 'eval_accuracy': 0.4395293092176945, 'eval_runtime': 0.574, 'eval_samples_per_second': 547.057, 'eval_steps_per_second': 5.227, 'epoch': 3.0, 'step': 30}, {'loss': 3.6427, 'learning_rate': 4.800000000000001e-06, 'epoch': 3.8, 'step': 38}, {'eval_loss': 3.1078619956970215, 'eval_precision': 0.0, 'eval_recall': 0.0, 'eval_f1': 0.0, 'eval_accuracy': 0.4395293092176945, 'eval_runtime': 0.5764, 'eval_samples_per_second': 544.762, 'eval_steps_per_second': 5.205, 'epoch': 4.0, 'step': 40}, {'eval_loss': 3.0618975162506104, 'eval_precision': 0.0, 'eval_recall': 0.0, 'eval_f1': 0.0, 'eval_accuracy': 0.4395293092176945, 'eval_runtime': 0.5582, 'eval_samples_per_second': 562.488, 'eval_steps_per_second': 5.374, 'epoch': 5.0, 'step': 50}, {'train_runtime': 33.1514, 'train_samples_per_second': 184.155, 'train_steps_per_second': 1.508, 'total_flos': 261323516551680.0, 'train_loss': 3.5247801208496092, 'epoch': 5.0, 'step': 50}]
wandb: - 0.014 MB of 0.014 MB uploadedwandb: \ 0.014 MB of 0.014 MB uploadedwandb: | 0.014 MB of 0.030 MB uploadedwandb: / 0.050 MB of 0.050 MB uploadedwandb: 
wandb: Run history:
wandb:                  eval/accuracy ▁████
wandb:                        eval/f1 █▂▁▁▁
wandb:                      eval/loss █▅▃▁▁
wandb:                 eval/precision ▃█▁▁▁
wandb:                    eval/recall █▂▁▁▁
wandb:                   eval/runtime █▇▅▆▁
wandb:        eval/samples_per_second ▁▂▄▃█
wandb:          eval/steps_per_second ▁▂▄▃█
wandb:                    train/epoch ▁▃▅▆▆██
wandb:              train/global_step ▁▃▅▆▆██
wandb:            train/learning_rate ▁
wandb:                     train/loss ▁
wandb:               train/total_flos ▁
wandb:               train/train_loss ▁
wandb:            train/train_runtime ▁
wandb: train/train_samples_per_second ▁
wandb:   train/train_steps_per_second ▁
wandb: 
wandb: Run summary:
wandb:                  eval/accuracy 0.43953
wandb:                        eval/f1 0.0
wandb:                      eval/loss 3.0619
wandb:                 eval/precision 0.0
wandb:                    eval/recall 0.0
wandb:                   eval/runtime 0.5582
wandb:        eval/samples_per_second 562.488
wandb:          eval/steps_per_second 5.374
wandb:                    train/epoch 5.0
wandb:              train/global_step 50
wandb:            train/learning_rate 0.0
wandb:                     train/loss 3.6427
wandb:               train/total_flos 261323516551680.0
wandb:               train/train_loss 3.52478
wandb:            train/train_runtime 33.1514
wandb: train/train_samples_per_second 184.155
wandb:   train/train_steps_per_second 1.508
wandb: 
wandb: 🚀 View run finetuned_distilkobert_ner_KD at: https://wandb.ai/ksr5970/huggingface/runs/vnocdrv4
wandb: Synced 6 W&B file(s), 0 media file(s), 0 artifact file(s) and 0 other file(s)
wandb: Find logs at: ./wandb/run-20240122_030417-vnocdrv4/logs
